{
  "$schema": "https://json-schema.org/draft/2020-12/schema",
  "$id": "https://aerost.dev/schemas/input-domain.schema.json",
  "title": "AEROST Bounded Input Domain",
  "type": "object",
  "additionalProperties": false,
  "required": [
    "schema_version",
    "profile_version",
    "program_id",
    "domain_id",
    "enumeration",
    "search_bounds",
    "initial_state_policy",
    "inputs",
    "constraints"
  ],
  "properties": {
    "$schema": {
      "type": "string"
    },
    "schema_version": {
      "const": "AEROST-INPUT-DOMAIN-0.1"
    },
    "profile_version": {
      "type": "string",
      "minLength": 1
    },
    "program_id": {
      "type": "string",
      "minLength": 1
    },
    "domain_id": {
      "type": "string",
      "pattern": "^AEROST-DOMAIN-[A-Z0-9][A-Z0-9._-]*$"
    },
    "enumeration": {
      "type": "object",
      "additionalProperties": false,
      "required": [
        "strategy",
        "ordering",
        "maximum_input_vectors"
      ],
      "properties": {
        "strategy": {
          "const": "cartesian"
        },
        "ordering": {
          "const": "air-declaration-order"
        },
        "maximum_input_vectors": {
          "type": "integer",
          "minimum": 1
        }
      }
    },
    "search_bounds": {
      "type": "object",
      "additionalProperties": false,
      "required": [
        "maximum_sequence_depth",
        "maximum_reachable_states",
        "maximum_transition_evaluations"
      ],
      "properties": {
        "maximum_sequence_depth": {
          "type": "integer",
          "minimum": 1
        },
        "maximum_reachable_states": {
          "type": "integer",
          "minimum": 1
        },
        "maximum_transition_evaluations": {
          "type": "integer",
          "minimum": 1
        }
      }
    },
    "initial_state_policy": {
      "const": "air_initializers"
    },
    "inputs": {
      "type": "array",
      "minItems": 1,
      "items": {
        "type": "object",
        "additionalProperties": false,
        "required": [
          "name",
          "type",
          "values"
        ],
        "properties": {
          "name": {
            "type": "string",
            "minLength": 1
          },
          "type": {
            "type": "string",
            "minLength": 1
          },
          "values": {
            "type": "array",
            "minItems": 1,
            "items": {}
          }
        }
      }
    },
    "constraints": {
      "type": "array",
      "maxItems": 0
    }
  }
}
